{
 "$schema": "https://json-schema.org/draft/2020-12/schema",
 "$id": "world-schema/quests.v2",
 "title": "A quest packet: quest records with their blueprint (quests/80 §58, decision 0153; 2.11 b)",
 "description": "The one source of the quest blueprint. The Python validator (worldgen.quests) validates through it; packages/narrative/src/blueprint.ts mirrors it field for field and blueprint.schema.test.ts holds the two equal. Conditions and actions are the quests/85 vocabulary, checked by name and arguments in the validator and compiled by packages/dialogue at load.",
 "type": "object",
 "required": ["schemaVersion", "packet", "quests"],
 "additionalProperties": false,
 "properties": {
  "schemaVersion": {"const": 2},
  "packet": {"type": "string"},
  "seed": {"type": "string"},
  "_": {"type": "string"},
  "budgetExceptions": {"type": "object"},
  "quests": {"type": "array", "items": {"$ref": "#/$defs/quest"}}
 },
 "$defs": {
  "questId": {"type": "string", "pattern": "^quest\\.[a-z0-9]+(-[a-z0-9]+)*\\.[a-z0-9]+(-[a-z0-9]+)*$"},
  "textKey": {"type": "string", "pattern": "^text\\.[a-z0-9-]+(\\.[a-z0-9-]+)+$"},
  "condition": {
   "description": "A quests/85 § A predicate call or an all/any/not composition (§ D); names and arguments are checked by the vocabulary.",
   "type": "object", "minProperties": 1, "maxProperties": 1
  },
  "action": {
   "description": "A quests/85 § B action call: exactly one key, its argument or argument list.",
   "type": "object", "minProperties": 1, "maxProperties": 1
  },
  "touch": {
   "type": "object", "additionalProperties": false, "required": ["id", "access"],
   "properties": {
    "id": {"type": "string", "pattern": "^[a-z]+\\.[a-z0-9.-]+$"},
    "access": {"enum": ["read", "write"]}
   }
  },
  "objective": {
   "type": "object", "additionalProperties": false, "required": ["id", "text", "completeWhen"],
   "properties": {
    "id": {"type": "string", "pattern": "^[a-z0-9]+(-[a-z0-9]+)*$"},
    "text": {"$ref": "#/$defs/textKey"},
    "completeWhen": {"$ref": "#/$defs/condition"},
    "optional": {"type": "boolean"},
    "where": {"$ref": "#/$defs/where"}
   }
  },
  "where": {
   "type": "object", "additionalProperties": false,
   "description": "Where an objective's person, thing or count stands in the facts record (2.11 § c).",
   "properties": {
    "place": {"type": "string", "pattern": "^place\\.", "description": "Defaults to the stage's place."},
    "ref": {"type": "string", "description": "The facts socket, stand or landmark id of the thing to find."},
    "area": {"type": "string", "description": "The facts counts area a count objective is gathered in."},
    "kind": {"enum": ["nodes", "plants", "items", "containers"], "description": "The facts count the objective's number is held against."}
   }
  },
  "direction": {
   "type": "object", "additionalProperties": false, "required": ["to"],
   "description": "A direction walked on the shipped route graph (0137) from where it is given to inside the named place's facts extent.",
   "properties": {
    "from": {"type": "string", "pattern": "^place\\.", "description": "Where it is given; defaults to the stage's place."},
    "to": {"type": "string", "pattern": "^place\\."},
    "landmarks": {"type": "array", "items": {"type": "string"}, "description": "Facts landmark ids it names; each in sight of the route."},
    "claims": {"type": "array", "items": {"$ref": "#/$defs/claim"}}
   }
  },
  "claim": {
   "type": "object", "additionalProperties": false, "required": ["subject", "bearing", "of"],
   "description": "A cardinal or relative claim (\"the cave east of town\"), judged on facts positions.",
   "properties": {
    "subject": {"type": "string", "description": "A place id or a facts landmark id."},
    "bearing": {"enum": ["east", "north-east", "north", "north-west", "west", "south-west", "south", "south-east", "inside", "outside"]},
    "of": {"type": "string", "pattern": "^place\\.", "description": "The bearing is taken from this place's facts position; inside/outside its facts extent."}
   }
  },
  "successor": {
   "type": "object", "additionalProperties": false, "required": ["to"],
   "properties": {
    "to": {"type": "integer", "minimum": 0},
    "when": {"$ref": "#/$defs/condition"}
   }
  },
  "stage": {
   "type": "object", "additionalProperties": false, "required": ["id", "objectives", "onEnter", "successors"],
   "properties": {
    "id": {"type": "integer", "minimum": 0, "description": "The stage number questStage compares."},
    "journal": {"anyOf": [{"$ref": "#/$defs/textKey"}, {"type": "null"}], "description": "The journal entry written on entering the stage."},
    "objectives": {"type": "array", "items": {"$ref": "#/$defs/objective"}},
    "onEnter": {"type": "array", "items": {"$ref": "#/$defs/action"}},
    "onComplete": {"type": "array", "items": {"$ref": "#/$defs/action"}},
    "successors": {"type": "array", "items": {"$ref": "#/$defs/successor"}, "description": "When every required objective is complete, the first successor whose when holds is entered."},
    "failForward": {"type": "array", "items": {"$ref": "#/$defs/successor"}, "description": "Checked at any time on this stage: a met when moves the quest on (fail-forward, quests/80 §63); each needs a when."},
    "ending": {"enum": ["complete", "failed"], "description": "Entering this stage ends the quest so."},
    "place": {"type": "string", "pattern": "^place\\.", "description": "The place this stage enters (read by the § c stance rule)."},
    "entry": {"enum": ["clear", "outside"], "description": "How a stage entering a hostile place is reached when no flip is met (2.11 § c)."},
    "directions": {"type": "array", "items": {"$ref": "#/$defs/direction"}, "description": "The directions the stage's journal or dialogue gives (2.11 § c)."},
    "outside": {
     "type": "object", "additionalProperties": false, "required": ["packet"],
     "description": "A partial quest stops here: the stage's place is past the slice and this Part 4 packet owns it (0153).",
     "properties": {"packet": {"type": "string", "pattern": "^4\\.\\d+[a-z]?(\\.[a-z0-9-]+)?$"}}
    }
   }
  },
  "quest": {
   "type": "object", "additionalProperties": false,
   "required": ["id", "code", "title", "line", "group", "tier", "status", "shapes", "region", "settlement", "anchorPlaces", "premise", "costTier", "milestone", "touches", "sources"],
   "properties": {
    "id": {"$ref": "#/$defs/questId"},
    "code": {"type": "string", "pattern": "^[A-Z]{2}\\d{2}$"},
    "title": {"type": "string"},
    "line": {"type": "string"},
    "group": {"type": "string"},
    "tier": {"type": "integer"},
    "status": {"type": "string"},
    "shapes": {"type": "array", "items": {"type": "string"}},
    "region": {"type": ["string", "null"]},
    "settlement": {"type": ["string", "null"]},
    "anchorPlaces": {"type": "array", "items": {"type": "string"}},
    "premise": {"type": "string"},
    "costTier": {"type": ["string", "null"]},
    "milestone": {"type": "integer"},
    "touches": {"type": "array", "items": {"$ref": "#/$defs/touch"}},
    "sockets": {"type": "array", "items": {"type": "string"}},
    "essentialTopics": {"type": "array", "items": {"type": "string", "pattern": "^topic\\."}},
    "notes": {"type": "string"},
    "sources": {"type": "array", "items": {"type": "string"}},
    "standInFor": {"$ref": "#/$defs/questId", "description": "0157: the canon quest this record stands in for until that quest's anchor is built."},
    "start": {"type": "integer", "minimum": 0, "description": "The first stage; defaults to the lowest stage id."},
    "startWhen": {"$ref": "#/$defs/condition", "description": "Any quests/85 condition: an unstarted quest enters its start stage on the first world event after it holds (a quest begun by what the player finds, not by a giver)."},
    "stages": {"type": "array", "items": {"$ref": "#/$defs/stage"}}
   }
  }
 }
}
