{
  "schemaVersion": 2,
  "packet": "local-pirate-freeholds",
  "seed": "quests-local-pirate-freeholds-v1",
  "quests": [
    {
      "id": "quest.local.lp01",
      "code": "LP01",
      "title": "Read Onto the Roll",
      "line": "quest.line.local",
      "group": "local",
      "tier": 3,
      "status": "skeleton",
      "shapes": [
        "BONDAGE",
        "FRAUD"
      ],
      "region": "pirate-freeholds",
      "settlement": "place.pirate-freeholds.alten-corimont",
      "anchorPlaces": [
        "place.pirate-freeholds.alten-corimont",
        "place.pirate-freeholds.opening-work-barge"
      ],
      "premise": "Every meal adds months to the barge ledger. A new hand can buy the entry off, argue it down or burn it.",
      "costTier": "S",
      "milestone": 1,
      "touches": [],
      "sources": [
        "docs/quests/index/coverage.md",
        "docs/research/phase11/phase11-critique/round3-region-brief.md",
        "world/sources/catalogue/places-pirate-freeholds.json",
        "docs/research/quests-and-cast/opening-hours-and-start-area.md"
      ]
    },
    {
      "id": "quest.local.lp02",
      "code": "LP02",
      "title": "Three Tenants and a Crate",
      "line": "quest.line.local",
      "group": "local",
      "tier": 3,
      "status": "skeleton",
      "shapes": [
        "THEFT",
        "PREDATOR"
      ],
      "region": "pirate-freeholds",
      "settlement": "place.pirate-freeholds.alten-corimont",
      "anchorPlaces": [
        "place.pirate-freeholds.alten-corimont",
        "place.pirate-freeholds.corimont-low-store"
      ],
      "premise": "The price list records the crate as paid. The crate is still in the flooded store. Three tenants moved in after the water. The three tenants are in the store with the crate.",
      "costTier": "S",
      "milestone": 1,
      "touches": [],
      "sources": [
        "docs/quests/index/coverage.md",
        "docs/research/phase11/phase11-critique/round3-region-brief.md",
        "world/sources/catalogue/places-pirate-freeholds.json",
        "docs/research/quests-and-cast/opening-hours-and-start-area.md"
      ]
    },
    {
      "id": "quest.local.lp03",
      "code": "LP03",
      "title": "Bearings for the Asking",
      "line": "quest.line.local",
      "group": "local",
      "tier": 3,
      "status": "skeleton",
      "shapes": [
        "NEGOTIATION",
        "WONDER"
      ],
      "region": "pirate-freeholds",
      "settlement": "place.pirate-freeholds.alten-corimont",
      "anchorPlaces": [
        "place.pirate-freeholds.alten-corimont",
        "place.pirate-freeholds.corimont-crosstrees"
      ],
      "premise": "The lookout at the crosstrees sells the name of each reach on the horizon. The lookout takes payment in news from the river below.",
      "costTier": "S",
      "milestone": 1,
      "touches": [],
      "sources": [
        "docs/quests/index/coverage.md",
        "docs/research/phase11/phase11-critique/round3-region-brief.md",
        "world/sources/catalogue/places-pirate-freeholds.json",
        "docs/research/quests-and-cast/opening-hours-and-start-area.md"
      ]
    },
    {
      "id": "quest.local.lp04",
      "code": "LP04",
      "title": "One Name Short",
      "line": "quest.line.local",
      "group": "local",
      "tier": 3,
      "status": "skeleton",
      "shapes": [
        "MISSING",
        "RITE"
      ],
      "region": "pirate-freeholds",
      "settlement": "place.pirate-freeholds.alten-corimont",
      "anchorPlaces": [
        "place.pirate-freeholds.alten-corimont",
        "place.pirate-freeholds.bone-repatriation-waystation"
      ],
      "premise": "The rack's tally is one name short. Carriers will not lift a bundle until a stranger helps count it back.",
      "costTier": "S",
      "milestone": 1,
      "touches": [],
      "sources": [
        "docs/quests/index/coverage.md",
        "docs/research/phase11/phase11-critique/round3-region-brief.md",
        "world/sources/catalogue/places-pirate-freeholds.json",
        "docs/research/quests-and-cast/opening-hours-and-start-area.md"
      ]
    },
    {
      "id": "quest.local.lp05",
      "code": "LP05",
      "title": "A Grade Moved Overnight",
      "line": "quest.line.local",
      "group": "local",
      "tier": 3,
      "status": "skeleton",
      "shapes": [
        "FRAUD",
        "DISPUTE"
      ],
      "region": "pirate-freeholds",
      "settlement": "place.pirate-freeholds.alten-corimont",
      "anchorPlaces": [
        "place.pirate-freeholds.alten-corimont",
        "place.pirate-freeholds.freehold-market"
      ],
      "premise": "An unnamed hand altered one grade on the nailed-up list in the dark. The altered grade puts a lawful cargo on the wrong side of the board.",
      "costTier": "M",
      "milestone": 2,
      "touches": [],
      "sources": [
        "docs/quests/index/coverage.md",
        "docs/research/phase11/phase11-critique/round3-region-brief.md",
        "world/sources/catalogue/places-pirate-freeholds.json"
      ]
    },
    {
      "id": "quest.local.lp06",
      "code": "LP06",
      "title": "Under the Turn of the Hull",
      "line": "quest.line.local",
      "group": "local",
      "tier": 3,
      "status": "skeleton",
      "shapes": [
        "MURDER",
        "RECKONING"
      ],
      "region": "pirate-freeholds",
      "settlement": "place.pirate-freeholds.alten-corimont",
      "anchorPlaces": [
        "place.pirate-freeholds.alten-corimont",
        "place.pirate-freeholds.careening-hard"
      ],
      "premise": "A boatwright is found under a careened hull. The yard's workers blame the tide.",
      "costTier": "M",
      "milestone": 2,
      "touches": [],
      "sources": [
        "docs/quests/index/coverage.md",
        "docs/research/phase11/phase11-critique/round3-region-brief.md",
        "world/sources/catalogue/places-pirate-freeholds.json"
      ]
    },
    {
      "id": "quest.local.lp07",
      "code": "LP07",
      "title": "Sixty Tun Salt",
      "line": "quest.line.local",
      "group": "local",
      "tier": 3,
      "status": "skeleton",
      "shapes": [
        "EXPEDITION",
        "THEFT"
      ],
      "region": "pirate-freeholds",
      "settlement": "place.pirate-freeholds.alten-corimont",
      "anchorPlaces": [
        "place.pirate-freeholds.alten-corimont",
        "place.pirate-freeholds.reach-wreck"
      ],
      "premise": "The wreck downriver still holds its consignment. Two crews are hiring divers for the consignment.",
      "costTier": "M",
      "milestone": 2,
      "touches": [],
      "sources": [
        "docs/quests/index/coverage.md",
        "docs/research/phase11/phase11-critique/round3-region-brief.md",
        "world/sources/catalogue/places-pirate-freeholds.json"
      ]
    },
    {
      "id": "quest.local.lp08",
      "code": "LP08",
      "title": "Repairs at the Old Pens",
      "line": "quest.line.local",
      "group": "local",
      "tier": 3,
      "status": "skeleton",
      "shapes": [
        "RECKONING",
        "BONDAGE"
      ],
      "region": "pirate-freeholds",
      "settlement": "place.pirate-freeholds.alten-corimont",
      "anchorPlaces": [
        "place.pirate-freeholds.alten-corimont",
        "place.pirate-freeholds.dres-holding-pens"
      ],
      "premise": "A contractor has begun repairing the slaver apparatus north of the town. The port's officials have not asked whose money pays for the work.",
      "costTier": "M",
      "milestone": 2,
      "touches": [],
      "sources": [
        "docs/quests/index/coverage.md",
        "docs/research/phase11/phase11-critique/round3-region-brief.md",
        "world/sources/catalogue/places-pirate-freeholds.json"
      ]
    },
    {
      "id": "quest.local.lp09",
      "code": "LP09",
      "title": "No Rope at Slack Bend",
      "line": "quest.line.local",
      "group": "local",
      "tier": 3,
      "status": "skeleton",
      "shapes": [
        "HAUNTING",
        "WONDER"
      ],
      "region": "pirate-freeholds",
      "settlement": "place.pirate-freeholds.alten-corimont",
      "anchorPlaces": [
        "place.pirate-freeholds.alten-corimont",
        "place.pirate-freeholds.kothringi-river-ruin"
      ],
      "premise": "Crews will not moor at the empty Kothringi bend. A voice has now hailed one crew from the landing.",
      "costTier": "M",
      "milestone": 2,
      "touches": [],
      "sources": [
        "docs/quests/index/coverage.md",
        "docs/research/phase11/phase11-critique/round3-region-brief.md",
        "world/sources/catalogue/places-pirate-freeholds.json"
      ]
    },
    {
      "id": "quest.local.lp10",
      "code": "LP10",
      "title": "The Room That Will Not Open",
      "line": "quest.line.local",
      "group": "local",
      "tier": 3,
      "status": "skeleton",
      "shapes": [
        "SUCCESSION",
        "DISPUTE"
      ],
      "region": "pirate-freeholds",
      "settlement": "place.pirate-freeholds.dunmer-frontier-holding",
      "anchorPlaces": [
        "place.pirate-freeholds.dunmer-frontier-holding"
      ],
      "premise": "The holding's heir was raised marsh-side. The ancestor room has stayed shut since the funeral.",
      "costTier": "M",
      "milestone": 2,
      "touches": [],
      "sources": [
        "docs/quests/index/coverage.md",
        "docs/research/phase11/phase11-critique/round3-region-brief.md",
        "world/sources/catalogue/places-pirate-freeholds.json"
      ]
    },
    {
      "id": "quest.local.lp11",
      "code": "LP11",
      "title": "The Last Lawful Cellar",
      "line": "quest.line.local",
      "group": "local",
      "tier": 3,
      "status": "skeleton",
      "shapes": [
        "SMUGGLING",
        "NEGOTIATION"
      ],
      "region": "pirate-freeholds",
      "settlement": "place.pirate-freeholds.dunmer-frontier-holding",
      "anchorPlaces": [
        "place.pirate-freeholds.alten-corimont",